{
  "schema_id": "bmas.test_manifest_result",
  "run_id": "20260830T201339Z-62d24a3a",
  "state": "passed",
  "started_at_utc": "2026-08-30T20:13:39.135151000Z",
  "ended_at_utc": "2026-08-30T20:14:31.324521000Z",
  "duration_nanos": 52189006875,
  "manifest_schema_version": "1.0.0",
  "manifest_digest": "96e1ef192c75ee344a49fe68908bf1eadd05866d8b6420031f43dc933b0d1a28",
  "profile_id": "complete",
  "resolved_group_ids": [
    "manifest.validate",
    "repo.source-naming",
    "repo.config-examples",
    "repo.config-schema",
    "repo.docs-links",
    "repo.compose-render",
    "scripts.tests",
    "conformance.reference-scorer",
    "daemon.lint",
    "daemon.typecheck",
    "daemon.tests",
    "agent.tests",
    "evaluation.tests",
    "mission-control.install",
    "mission-control.audit",
    "mission-control.lint",
    "mission-control.typecheck",
    "mission-control.tests",
    "mission-control.build",
    "mission-control.browser-install",
    "mission-control.e2e"
  ],
  "repository": {
    "commit": "513c59cbd3e3d7f3e26ba3f00dccc890bc2b483b",
    "branch": "foundation-stage-0a-freeze",
    "dirty": false,
    "tracked_diff_sha256": "e3b0c44298fc1c149afbf4c8996fb92427ae41e4649b934ca495991b7852b855",
    "untracked_files": []
  },
  "host": {
    "os": "Darwin",
    "architecture": "arm64",
    "image_digest": null,
    "kernel_version": "25.6.0",
    "utc_clock_source": "python.time.time_ns",
    "monotonic_clock": "python.time.monotonic_ns/mach_absolute_time()",
    "tool_versions": {
      "docker": "Docker version 29.4.0, build 9d7ad9f",
      "git": "git version 2.50.1 (Apple Git-155)",
      "mypy": "mypy 2.3.1 (compiled: yes)",
      "node": "v26.3.0",
      "npm": "11.16.0",
      "playwright": "unavailable",
      "pytest": "pytest 9.1.1",
      "python": "Python 3.13.14",
      "ruff": "ruff 0.16.5"
    }
  },
  "summary": {
    "passed": 21,
    "failed": 0,
    "skipped": 0,
    "cancelled": 0,
    "timed_out": 0,
    "infrastructure_error": 0,
    "attempt_count": 21,
    "retry_count": 0
  },
  "groups": [
    {
      "group_id": "manifest.validate",
      "manifest_entry_digest": "24b1b5e98480cd07a131de02686de04f4e6a5de5a94e7f516337e8e625f48467",
      "argv": [
        "python3",
        "scripts/validate-test-manifest.py"
      ],
      "working_directory": ".",
      "environment_profile_digest": "cd51dfa14595b6553b9e06b277bbe885b4fb1f9b2d5593ec11c760e33650890f",
      "dependency_versions": {},
      "tool_versions": {
        "python": "Python 3.13.14"
      },
      "timeout_nanos": 300000000000,
      "started_at_utc": "2026-08-30T20:13:40.026265000Z",
      "ended_at_utc": "2026-08-30T20:13:40.166719000Z",
      "duration_nanos": 140338375,
      "state": "passed",
      "skip_reason": null,
      "attempts": [
        {
          "attempt_index": 0,
          "state": "passed",
          "exit_code": 0,
          "signal": null,
          "retry_reason": null,
          "started_at_utc": "2026-08-30T20:13:40.034010000Z",
          "ended_at_utc": "2026-08-30T20:13:40.166011000Z",
          "duration_nanos": 131982291,
          "counts": {
            "passed": 1,
            "failed": 0,
            "skipped": 0
          },
          "stdout_sha256": "5a83faca8b6c7c48db7dc8a19eac34f93ce6bafbb687e1e68e2c5f7515c1ec98",
          "stderr_sha256": "e3b0c44298fc1c149afbf4c8996fb92427ae41e4649b934ca495991b7852b855",
          "logs": [
            {
              "path": "groups/manifest.validate/attempt-0/stdout.log",
              "media_type": "text/plain",
              "size_bytes": 262,
              "sha256": "5a83faca8b6c7c48db7dc8a19eac34f93ce6bafbb687e1e68e2c5f7515c1ec98"
            },
            {
              "path": "groups/manifest.validate/attempt-0/stderr.log",
              "media_type": "text/plain",
              "size_bytes": 0,
              "sha256": "e3b0c44298fc1c149afbf4c8996fb92427ae41e4649b934ca495991b7852b855"
            }
          ],
          "artifacts": []
        }
      ],
      "artifacts": []
    },
    {
      "group_id": "repo.source-naming",
      "manifest_entry_digest": "0b49afca4a0e5cf36ad12953841b6d03642783d695873eb3540e17666d8fc7e5",
      "argv": [
        "python3",
        "scripts/check-source-naming.py"
      ],
      "working_directory": ".",
      "environment_profile_digest": "cd51dfa14595b6553b9e06b277bbe885b4fb1f9b2d5593ec11c760e33650890f",
      "dependency_versions": {},
      "tool_versions": {
        "python": "Python 3.13.14"
      },
      "timeout_nanos": 300000000000,
      "started_at_utc": "2026-08-30T20:13:40.166740000Z",
      "ended_at_utc": "2026-08-30T20:13:40.902112000Z",
      "duration_nanos": 735301125,
      "state": "passed",
      "skip_reason": null,
      "attempts": [
        {
          "attempt_index": 0,
          "state": "passed",
          "exit_code": 0,
          "signal": null,
          "retry_reason": null,
          "started_at_utc": "2026-08-30T20:13:40.175780000Z",
          "ended_at_utc": "2026-08-30T20:13:40.901551000Z",
          "duration_nanos": 725748542,
          "counts": {
            "passed": 1,
            "failed": 0,
            "skipped": 0
          },
          "stdout_sha256": "36c6a05946cf1a54fa6b6cee7db40366afeaacc49cc09a1c74fbd5214d37dcaa",
          "stderr_sha256": "e3b0c44298fc1c149afbf4c8996fb92427ae41e4649b934ca495991b7852b855",
          "logs": [
            {
              "path": "groups/repo.source-naming/attempt-0/stdout.log",
              "media_type": "text/plain",
              "size_bytes": 108,
              "sha256": "36c6a05946cf1a54fa6b6cee7db40366afeaacc49cc09a1c74fbd5214d37dcaa"
            },
            {
              "path": "groups/repo.source-naming/attempt-0/stderr.log",
              "media_type": "text/plain",
              "size_bytes": 0,
              "sha256": "e3b0c44298fc1c149afbf4c8996fb92427ae41e4649b934ca495991b7852b855"
            }
          ],
          "artifacts": []
        }
      ],
      "artifacts": []
    },
    {
      "group_id": "repo.config-examples",
      "manifest_entry_digest": "ae9dbf333faa8d301725563f9414e58f7098b66c3a4acf7bccdcbb74e663c3a5",
      "argv": [
        "python3",
        "scripts/validate_configs.py"
      ],
      "working_directory": ".",
      "environment_profile_digest": "cd51dfa14595b6553b9e06b277bbe885b4fb1f9b2d5593ec11c760e33650890f",
      "dependency_versions": {},
      "tool_versions": {
        "python": "Python 3.13.14"
      },
      "timeout_nanos": 300000000000,
      "started_at_utc": "2026-08-30T20:13:40.902125000Z",
      "ended_at_utc": "2026-08-30T20:13:41.534932000Z",
      "duration_nanos": 632736750,
      "state": "passed",
      "skip_reason": null,
      "attempts": [
        {
          "attempt_index": 0,
          "state": "passed",
          "exit_code": 0,
          "signal": null,
          "retry_reason": null,
          "started_at_utc": "2026-08-30T20:13:40.910991000Z",
          "ended_at_utc": "2026-08-30T20:13:41.534533000Z",
          "duration_nanos": 623523083,
          "counts": {
            "passed": 1,
            "failed": 0,
            "skipped": 0
          },
          "stdout_sha256": "8354c2b900eba1b50e98bd34943d5c3446ed1ef9026897dc62c412ce053ebb85",
          "stderr_sha256": "e3b0c44298fc1c149afbf4c8996fb92427ae41e4649b934ca495991b7852b855",
          "logs": [
            {
              "path": "groups/repo.config-examples/attempt-0/stdout.log",
              "media_type": "text/plain",
              "size_bytes": 191,
              "sha256": "8354c2b900eba1b50e98bd34943d5c3446ed1ef9026897dc62c412ce053ebb85"
            },
            {
              "path": "groups/repo.config-examples/attempt-0/stderr.log",
              "media_type": "text/plain",
              "size_bytes": 0,
              "sha256": "e3b0c44298fc1c149afbf4c8996fb92427ae41e4649b934ca495991b7852b855"
            }
          ],
          "artifacts": []
        }
      ],
      "artifacts": []
    },
    {
      "group_id": "repo.config-schema",
      "manifest_entry_digest": "f665aa6ed7d0fa2e1e75073a4ee85245be4185d5092db4e0546c079cfc1d43fd",
      "argv": [
        "python3",
        "scripts/generate_config_schema.py",
        "--check"
      ],
      "working_directory": ".",
      "environment_profile_digest": "cd51dfa14595b6553b9e06b277bbe885b4fb1f9b2d5593ec11c760e33650890f",
      "dependency_versions": {},
      "tool_versions": {
        "python": "Python 3.13.14"
      },
      "timeout_nanos": 300000000000,
      "started_at_utc": "2026-08-30T20:13:41.534951000Z",
      "ended_at_utc": "2026-08-30T20:13:41.676596000Z",
      "duration_nanos": 141578083,
      "state": "passed",
      "skip_reason": null,
      "attempts": [
        {
          "attempt_index": 0,
          "state": "passed",
          "exit_code": 0,
          "signal": null,
          "retry_reason": null,
          "started_at_utc": "2026-08-30T20:13:41.543816000Z",
          "ended_at_utc": "2026-08-30T20:13:41.675896000Z",
          "duration_nanos": 132062792,
          "counts": {
            "passed": 1,
            "failed": 0,
            "skipped": 0
          },
          "stdout_sha256": "b4f8e7185b72bbf3b58d88cd143f3b0b3f0d97c3e4b46e2bc96531477b7c2450",
          "stderr_sha256": "e3b0c44298fc1c149afbf4c8996fb92427ae41e4649b934ca495991b7852b855",
          "logs": [
            {
              "path": "groups/repo.config-schema/attempt-0/stdout.log",
              "media_type": "text/plain",
              "size_bytes": 53,
              "sha256": "b4f8e7185b72bbf3b58d88cd143f3b0b3f0d97c3e4b46e2bc96531477b7c2450"
            },
            {
              "path": "groups/repo.config-schema/attempt-0/stderr.log",
              "media_type": "text/plain",
              "size_bytes": 0,
              "sha256": "e3b0c44298fc1c149afbf4c8996fb92427ae41e4649b934ca495991b7852b855"
            }
          ],
          "artifacts": []
        }
      ],
      "artifacts": []